[
    {
        "$schema": "../review_response_schema.json",
        "filmId": 1,
        "reviewId": 1,
        "reviewers": ["http://film-library.com/api/users/1", "http://film-library.com/api/users/2"],
        "completed": true,
        "reviewDate": "2022-02-22",
        "review_type": "single",
        "rating": 4,
        "review": "Non molto interessante.",
        "self": "http://film-library.com/api/films/public/2/reviews/1",
        "draftsLink": "http://film-library.com/api/films/public/2/reviews/1/drafts"
    },
    {
        "$schema": "./review_response_schema.json",
        "filmId": 1,
        "reviewId": 1,
        "reviewers": ["http://film-library.com/api/users/1", "http://film-library.com/api/users/2"],
        "completed": false,
        "review_type": "coop",
        "self": "http://film-library.com/api/films/public/2/reviews/1",
        "draftsLink": "http://film-library.com/api/films/public/2/reviews/1/drafts"
    }
]